{
  "contract_status": "walk_forward_result_contract_complete",
  "fold_results": [
    {
      "configuration": {
        "account_currency": "USD",
        "account_type": "cash",
        "name": "wf-v1-spy-2021",
        "out_of_sample_days": 0,
        "parameters": {
          "fold-id": "spy-2021",
          "optimization-mode": "false"
        }
      },
      "evaluation_end": "2021-12-31",
      "evaluation_start": "2021-01-01",
      "fold_id": "spy-2021",
      "metrics": {
        "derived": {
          "benchmark_ending_value": "446.8983",
          "benchmark_return": "0.287288146822267145136025597",
          "benchmark_starting_value": "347.1626",
          "excess_return": "-0.265449984822267145136025597",
          "total_return": "0.021838162"
        },
        "directly_reported": {
          "ending_equity_usd": "102183.8162",
          "fee_precision": "rounded_to_cent",
          "fee_validation_source": "overview_runtime_rounded",
          "maximum_drawdown": "0.005",
          "order_count": 18,
          "order_event_fee_evidence_available": false,
          "probabilistic_sharpe_ratio": "0.6008",
          "sharpe_ratio": "1.2261",
          "sortino_ratio": "1.4044",
          "starting_equity_usd": "100000",
          "total_fees_usd": "18"
        },
        "unavailable": [
          "algorithm_risk_halt_state",
          "engine_version",
          "estimated_slippage_usd",
          "rejected_order_count",
          "order_event_detail"
        ]
      },
      "orders": {
        "completed_order_count": 18,
        "final_position_quantity": "22",
        "final_position_state": "long",
        "order_validation_source": "completed_orders"
      },
      "protocol": {
        "content_sha256": "9b111d41c443f48a9325ec1e4050cd3198af02a36562ef04fcd666f2ea97b658",
        "name": "fixed_parameter_rolling_walk_forward",
        "version": "1.0.0"
      },
      "record_type": "walk_forward_result_observation",
      "schema_version": "1.0.0",
      "source": {
        "importer_schema_sha256": "dc31989d5745ce40d5abfe1aeba56aeb9056efedf00b0529a572adfdca958fbf",
        "importer_schema_version": "1.0.0",
        "project_source_sha256": "08643561aba659aed94b3b60bf592131b8bb7abbded2a80a2c1775342fbd9c97",
        "public_configuration_sha256": "839060795b82448e3fa54d0dc2455b6997e4067f73b6219a190850501e65765f",
        "source_verification_attestation": "selected_private_cloud_project_source_and_public_configuration_verified_against_merged_repository_before_execution"
      },
      "source_format": "quantconnect_result_json",
      "state": {
        "completion_status": "completed"
      }
    },
    {
      "configuration": {
        "account_currency": "USD",
        "account_type": "cash",
        "name": "wf-v1-spy-2022",
        "out_of_sample_days": 0,
        "parameters": {
          "fold-id": "spy-2022",
          "optimization-mode": "false"
        }
      },
      "evaluation_end": "2022-12-31",
      "evaluation_start": "2022-01-01",
      "fold_id": "spy-2022",
      "metrics": {
        "derived": {
          "benchmark_ending_value": "365.6736",
          "benchmark_return": "-0.1817520899050186586075623917",
          "benchmark_starting_value": "446.8983",
          "excess_return": "0.1565720859050186586075623917",
          "total_return": "-0.025180004"
        },
        "directly_reported": {
          "ending_equity_usd": "97481.9996",
          "fee_precision": "rounded_to_cent",
          "fee_validation_source": "overview_runtime_rounded",
          "maximum_drawdown": "0.027",
          "order_count": 20,
          "order_event_fee_evidence_available": false,
          "probabilistic_sharpe_ratio": "0",
          "sharpe_ratio": "-3.3318",
          "sortino_ratio": "-2.4668",
          "starting_equity_usd": "100000",
          "total_fees_usd": "20"
        },
        "unavailable": [
          "algorithm_risk_halt_state",
          "engine_version",
          "estimated_slippage_usd",
          "rejected_order_count",
          "order_event_detail"
        ]
      },
      "orders": {
        "completed_order_count": 20,
        "final_position_quantity": "26",
        "final_position_state": "long",
        "order_validation_source": "completed_orders"
      },
      "protocol": {
        "content_sha256": "9b111d41c443f48a9325ec1e4050cd3198af02a36562ef04fcd666f2ea97b658",
        "name": "fixed_parameter_rolling_walk_forward",
        "version": "1.0.0"
      },
      "record_type": "walk_forward_result_observation",
      "schema_version": "1.0.0",
      "source": {
        "importer_schema_sha256": "dc31989d5745ce40d5abfe1aeba56aeb9056efedf00b0529a572adfdca958fbf",
        "importer_schema_version": "1.0.0",
        "project_source_sha256": "08643561aba659aed94b3b60bf592131b8bb7abbded2a80a2c1775342fbd9c97",
        "public_configuration_sha256": "839060795b82448e3fa54d0dc2455b6997e4067f73b6219a190850501e65765f",
        "source_verification_attestation": "selected_private_cloud_project_source_and_public_configuration_verified_against_merged_repository_before_execution"
      },
      "source_format": "quantconnect_result_json",
      "state": {
        "completion_status": "completed"
      }
    },
    {
      "configuration": {
        "account_currency": "USD",
        "account_type": "cash",
        "name": "wf-v1-spy-2023",
        "out_of_sample_days": 0,
        "parameters": {
          "fold-id": "spy-2023",
          "optimization-mode": "false"
        }
      },
      "evaluation_end": "2023-12-31",
      "evaluation_start": "2023-01-01",
      "fold_id": "spy-2023",
      "metrics": {
        "derived": {
          "benchmark_ending_value": "461.3924",
          "benchmark_return": "0.261760214573871343186929546",
          "benchmark_starting_value": "365.6736",
          "excess_return": "-0.253464909573871343186929546",
          "total_return": "0.008295305"
        },
        "directly_reported": {
          "ending_equity_usd": "100829.5305",
          "fee_precision": "rounded_to_cent",
          "fee_validation_source": "overview_runtime_rounded",
          "maximum_drawdown": "0.01",
          "order_count": 17,
          "order_event_fee_evidence_available": false,
          "probabilistic_sharpe_ratio": "0",
          "sharpe_ratio": "-5.8356",
          "sortino_ratio": "-5.9471",
          "starting_equity_usd": "100000",
          "total_fees_usd": "17"
        },
        "unavailable": [
          "algorithm_risk_halt_state",
          "engine_version",
          "estimated_slippage_usd",
          "rejected_order_count",
          "order_event_detail"
        ]
      },
      "orders": {
        "completed_order_count": 17,
        "final_position_quantity": "21",
        "final_position_state": "long",
        "order_validation_source": "completed_orders"
      },
      "protocol": {
        "content_sha256": "9b111d41c443f48a9325ec1e4050cd3198af02a36562ef04fcd666f2ea97b658",
        "name": "fixed_parameter_rolling_walk_forward",
        "version": "1.0.0"
      },
      "record_type": "walk_forward_result_observation",
      "schema_version": "1.0.0",
      "source": {
        "importer_schema_sha256": "dc31989d5745ce40d5abfe1aeba56aeb9056efedf00b0529a572adfdca958fbf",
        "importer_schema_version": "1.0.0",
        "project_source_sha256": "08643561aba659aed94b3b60bf592131b8bb7abbded2a80a2c1775342fbd9c97",
        "public_configuration_sha256": "839060795b82448e3fa54d0dc2455b6997e4067f73b6219a190850501e65765f",
        "source_verification_attestation": "selected_private_cloud_project_source_and_public_configuration_verified_against_merged_repository_before_execution"
      },
      "source_format": "quantconnect_result_json",
      "state": {
        "completion_status": "completed"
      }
    },
    {
      "configuration": {
        "account_currency": "USD",
        "account_type": "cash",
        "name": "wf-v1-spy-2024",
        "out_of_sample_days": 0,
        "parameters": {
          "fold-id": "spy-2024",
          "optimization-mode": "false"
        }
      },
      "evaluation_end": "2024-12-31",
      "evaluation_start": "2024-01-01",
      "fold_id": "spy-2024",
      "metrics": {
        "derived": {
          "benchmark_ending_value": "576.2156",
          "benchmark_return": "0.248862356640464819099751101",
          "benchmark_starting_value": "461.3924",
          "excess_return": "-0.232121822640464819099751101",
          "total_return": "0.016740534"
        },
        "directly_reported": {
          "ending_equity_usd": "101674.0534",
          "fee_precision": "rounded_to_cent",
          "fee_validation_source": "overview_runtime_rounded",
          "maximum_drawdown": "0.008",
          "order_count": 17,
          "order_event_fee_evidence_available": false,
          "probabilistic_sharpe_ratio": "0",
          "sharpe_ratio": "-4.5968",
          "sortino_ratio": "-4.6691",
          "starting_equity_usd": "100000",
          "total_fees_usd": "17"
        },
        "unavailable": [
          "algorithm_risk_halt_state",
          "engine_version",
          "estimated_slippage_usd",
          "rejected_order_count",
          "order_event_detail"
        ]
      },
      "orders": {
        "completed_order_count": 17,
        "final_position_quantity": "17",
        "final_position_state": "long",
        "order_validation_source": "completed_orders"
      },
      "protocol": {
        "content_sha256": "9b111d41c443f48a9325ec1e4050cd3198af02a36562ef04fcd666f2ea97b658",
        "name": "fixed_parameter_rolling_walk_forward",
        "version": "1.0.0"
      },
      "record_type": "walk_forward_result_observation",
      "schema_version": "1.0.0",
      "source": {
        "importer_schema_sha256": "dc31989d5745ce40d5abfe1aeba56aeb9056efedf00b0529a572adfdca958fbf",
        "importer_schema_version": "1.0.0",